{
  "case_number": "1111222233334446",
  "po_box": "XXXX",
  "jurisdiction": "SSCS",
  "delivery_date": "23-02-2017 00:00:00.100000",
  "opening_date": "24-02-2017 00:00:00.010000",
  "zip_file_createddate": "24-02-2017 00:00:00.001000",
  "zip_file_name": "1_24-02-2017-00-00-00.zip",
  "urgent": "false",
  "classification": "new_application",
  "scannable_items": [
    {
      "document_control_number": "1111001",
      "scanning_date": "24-02-2017 00:00:00.000001",
      "manual_intervention": "string",
      "next_action": "forward",
      "next_action_date": "25-02-2017 00:00:00.000000",
      "file_name": "1111001.pdf",
      "notes": "test",
      "document_type": "Other"
    },
    {
      "document_control_number": "1111002",
      "scanning_date": "24-02-2017 00:00:00.000001",
      "manual_intervention": "string",
      "next_action": "forward",
      "next_action_date": "25-02-2017 00:00:00.000000",
      "file_name": "1111002.pdf",
      "notes": "Cheque will be forwarded to court to bank it",
      "document_type": "Other"
    }
  ],
  "payments": [
    {
      "document_control_number": "1111002",
      "method": "Cash",
      "amount": "100.00",
      "currency": "GBP"
    }
  ],
  "non_scannable_items": [
    {
      "document_control_number": "1111001",
      "item_type": "CD",
      "notes": "4GB USB memory stick"
    }
  ]
}
